OpenROAD 41a51eaf4ca2171c92ff38afb91eb37bbd3f36da 
This program is licensed under the BSD-3 license. See the LICENSE file for details.
Components of this program may be licensed under more restrictive licenses which must be honored.
[INFO]: Reading ODB at '/home/engtech/Desktop/Openlane_v2/memristor_v2/openlane/user_proj_example/runs/24_04_23_14_22/tmp/routing/25-fill.odb'…
define_corners Typical
read_liberty -corner Typical /home/engtech/Desktop/Openlane_v2/memristor_v2/dependencies/pdks/sky130B/libs.ref/sky130_fd_sc_hd/lib/sky130_fd_sc_hd__tt_025C_1v80.lib
Using 1e-12 for capacitance...
Using 1e+03 for resistance...
Using 1e-09 for time...
Using 1e+00 for voltage...
Using 1e-03 for current...
Using 1e-09 for power...
Using 1e-06 for distance...
Reading design constraints file at '/home/engtech/Desktop/Openlane_v2/memristor_v2/openlane/user_proj_example/runs/24_04_23_14_22/tmp/18-user_proj_example.sdc'…
[INFO ORD-0030] Using 2 thread(s).
[INFO DRT-0149] Reading tech and libs.

Units:                1000
Number of layers:     13
Number of macros:     442
Number of vias:       25
Number of viarulegen: 25

[INFO DRT-0150] Reading design.

Design:                   user_proj_example
Die area:                 ( 0 0 ) ( 1400000 1400000 )
Number of track patterns: 12
Number of DEF vias:       0
Number of components:     145462
Number of terminals:      22
Number of snets:          4
Number of nets:           24

[INFO DRT-0167] List of default vias:
  Layer mcon
    default via: L1M1_PR
  Layer via
    default via: M1M2_PR
  Layer via2
    default via: M2M3_PR
  Layer via3
    default via: M3M4_PR
  Layer via4
    default via: M4M5_PR
[INFO DRT-0162] Library cell analysis.
[INFO DRT-0163] Instance analysis.
  Complete 10000 instances.
  Complete 20000 instances.
  Complete 30000 instances.
  Complete 40000 instances.
  Complete 50000 instances.
  Complete 60000 instances.
  Complete 70000 instances.
  Complete 80000 instances.
  Complete 90000 instances.
  Complete 100000 instances.
[INFO DRT-0164] Number of unique instances = 28.
[INFO DRT-0168] Init region query.
[INFO DRT-0018]   Complete 10000 insts.
[INFO DRT-0018]   Complete 20000 insts.
[INFO DRT-0018]   Complete 30000 insts.
[INFO DRT-0018]   Complete 40000 insts.
[INFO DRT-0018]   Complete 50000 insts.
[INFO DRT-0018]   Complete 60000 insts.
[INFO DRT-0018]   Complete 70000 insts.
[INFO DRT-0018]   Complete 80000 insts.
[INFO DRT-0018]   Complete 90000 insts.
[INFO DRT-0019]   Complete 100000 insts.
[INFO DRT-0024]   Complete FR_MASTERSLICE.
[INFO DRT-0024]   Complete Fr_VIA.
[INFO DRT-0024]   Complete li1.
[INFO DRT-0024]   Complete mcon.
[INFO DRT-0024]   Complete met1.
[INFO DRT-0024]   Complete via.
[INFO DRT-0024]   Complete met2.
[INFO DRT-0024]   Complete via2.
[INFO DRT-0024]   Complete met3.
[INFO DRT-0024]   Complete via3.
[INFO DRT-0024]   Complete met4.
[INFO DRT-0024]   Complete via4.
[INFO DRT-0024]   Complete met5.
[INFO DRT-0033] FR_MASTERSLICE shape region query size = 0.
[INFO DRT-0033] FR_VIA shape region query size = 0.
[INFO DRT-0033] li1 shape region query size = 749445.
[INFO DRT-0033] mcon shape region query size = 2139284.
[INFO DRT-0033] met1 shape region query size = 295224.
[INFO DRT-0033] via shape region query size = 17685.
[INFO DRT-0033] met2 shape region query size = 10634.
[INFO DRT-0033] via2 shape region query size = 14148.
[INFO DRT-0033] met3 shape region query size = 10648.
[INFO DRT-0033] via3 shape region query size = 15848.
[INFO DRT-0033] met4 shape region query size = 3629.
[INFO DRT-0033] via4 shape region query size = 0.
[INFO DRT-0033] met5 shape region query size = 0.
[INFO DRT-0165] Start pin access.
[INFO DRT-0078]   Complete 23 pins.
[INFO DRT-0081]   Complete 9 unique inst patterns.
[INFO DRT-0084]   Complete 24 groups.
#scanned instances     = 145462
#unique  instances     = 28
#stdCellGenAp          = 130
#stdCellValidPlanarAp  = 0
#stdCellValidViaAp     = 96
#stdCellPinNoAp        = 0
#stdCellPinCnt         = 21
#instTermValidViaApCnt = 0
#macroGenAp            = 30
#macroValidPlanarAp    = 30
#macroValidViaAp       = 3
#macroNoAp             = 0
[INFO DRT-0166] Complete pin access.
[INFO DRT-0267] cpu time = 00:00:00, elapsed time = 00:00:00, memory = 478.67 (MB), peak = 526.87 (MB)

Number of guides:     149

[INFO DRT-0169] Post process guides.
[INFO DRT-0176] GCELLGRID X 0 DO 202 STEP 6900 ;
[INFO DRT-0177] GCELLGRID Y 0 DO 202 STEP 6900 ;
[INFO DRT-0028]   Complete FR_MASTERSLICE.
[INFO DRT-0028]   Complete Fr_VIA.
[INFO DRT-0028]   Complete li1.
[INFO DRT-0028]   Complete mcon.
[INFO DRT-0028]   Complete met1.
[INFO DRT-0028]   Complete via.
[INFO DRT-0028]   Complete met2.
[INFO DRT-0028]   Complete via2.
[INFO DRT-0028]   Complete met3.
[INFO DRT-0028]   Complete via3.
[INFO DRT-0028]   Complete met4.
[INFO DRT-0028]   Complete via4.
[INFO DRT-0028]   Complete met5.
[INFO DRT-0178] Init guide query.
[INFO DRT-0035]   Complete FR_MASTERSLICE (guide).
[INFO DRT-0035]   Complete Fr_VIA (guide).
[INFO DRT-0035]   Complete li1 (guide).
[INFO DRT-0035]   Complete mcon (guide).
[INFO DRT-0035]   Complete met1 (guide).
[INFO DRT-0035]   Complete via (guide).
[INFO DRT-0035]   Complete met2 (guide).
[INFO DRT-0035]   Complete via2 (guide).
[INFO DRT-0035]   Complete met3 (guide).
[INFO DRT-0035]   Complete via3 (guide).
[INFO DRT-0035]   Complete met4 (guide).
[INFO DRT-0035]   Complete via4 (guide).
[INFO DRT-0035]   Complete met5 (guide).
[INFO DRT-0036] FR_MASTERSLICE guide region query size = 0.
[INFO DRT-0036] FR_VIA guide region query size = 0.
[INFO DRT-0036] li1 guide region query size = 30.
[INFO DRT-0036] mcon guide region query size = 0.
[INFO DRT-0036] met1 guide region query size = 35.
[INFO DRT-0036] via guide region query size = 0.
[INFO DRT-0036] met2 guide region query size = 34.
[INFO DRT-0036] via2 guide region query size = 0.
[INFO DRT-0036] met3 guide region query size = 10.
[INFO DRT-0036] via3 guide region query size = 0.
[INFO DRT-0036] met4 guide region query size = 2.
[INFO DRT-0036] via4 guide region query size = 0.
[INFO DRT-0036] met5 guide region query size = 0.
[INFO DRT-0179] Init gr pin query.
[INFO DRT-0245] skipped writing guide updates to database.
[INFO DRT-0185] Post process initialize RPin region query.
[INFO DRT-0181] Start track assignment.
[INFO DRT-0184] Done with 66 vertical wires in 5 frboxes and 45 horizontal wires in 5 frboxes.
[INFO DRT-0186] Done with 4 vertical wires in 5 frboxes and 3 horizontal wires in 5 frboxes.
[INFO DRT-0182] Complete track assignment.
[INFO DRT-0267] cpu time = 00:00:07, elapsed time = 00:00:03, memory = 543.06 (MB), peak = 800.79 (MB)
[INFO DRT-0187] Start routing data preparation.
[INFO DRT-0267] cpu time = 00:00:00, elapsed time = 00:00:00, memory = 543.06 (MB), peak = 800.79 (MB)
[INFO DRT-0194] Start detail routing.
[INFO DRT-0195] Start 0th optimization iteration.
    Completing 10% with 0 violations.
    elapsed time = 00:00:02, memory = 813.81 (MB).
    Completing 20% with 0 violations.
    elapsed time = 00:00:05, memory = 1379.88 (MB).
    Completing 30% with 0 violations.
    elapsed time = 00:00:08, memory = 1214.50 (MB).
    Completing 40% with 0 violations.
    elapsed time = 00:00:10, memory = 1394.32 (MB).
    Completing 50% with 0 violations.
    elapsed time = 00:00:14, memory = 1730.50 (MB).
    Completing 60% with 0 violations.
    elapsed time = 00:00:16, memory = 1270.41 (MB).
    Completing 70% with 0 violations.
    elapsed time = 00:00:19, memory = 1537.41 (MB).
    Completing 80% with 0 violations.
    elapsed time = 00:00:22, memory = 1202.69 (MB).
    Completing 90% with 0 violations.
    elapsed time = 00:00:25, memory = 1406.69 (MB).
    Completing 100% with 1 violations.
    elapsed time = 00:00:29, memory = 1136.66 (MB).
[INFO DRT-0199]   Number of violations = 1.
Viol/Layer        met3
Metal Spacing        1
[INFO DRT-0267] cpu time = 00:00:57, elapsed time = 00:00:29, memory = 1136.66 (MB), peak = 1816.19 (MB)
Total wire length = 5031 um.
Total wire length on LAYER li1 = 0 um.
Total wire length on LAYER met1 = 1554 um.
Total wire length on LAYER met2 = 1930 um.
Total wire length on LAYER met3 = 155 um.
Total wire length on LAYER met4 = 1391 um.
Total wire length on LAYER met5 = 0 um.
Total number of vias = 84.
Up-via summary (total 84):.

---------------------
 FR_MASTERSLICE     0
            li1    30
           met1    40
           met2    10
           met3     4
           met4     0
---------------------
                   84


[INFO DRT-0195] Start 1st optimization iteration.
    Completing 10% with 1 violations.
    elapsed time = 00:00:02, memory = 1321.94 (MB).
    Completing 20% with 1 violations.
    elapsed time = 00:00:05, memory = 1612.75 (MB).
    Completing 30% with 1 violations.
    elapsed time = 00:00:08, memory = 1233.61 (MB).
    Completing 40% with 1 violations.
    elapsed time = 00:00:10, memory = 1436.11 (MB).
    Completing 50% with 1 violations.
    elapsed time = 00:00:14, memory = 1778.11 (MB).
    Completing 60% with 1 violations.
    elapsed time = 00:00:17, memory = 1330.88 (MB).
    Completing 70% with 1 violations.
    elapsed time = 00:00:20, memory = 1644.57 (MB).
    Completing 80% with 1 violations.
    elapsed time = 00:00:23, memory = 1233.66 (MB).
    Completing 90% with 1 violations.
    elapsed time = 00:00:25, memory = 1446.28 (MB).
    Completing 100% with 0 violations.
    elapsed time = 00:00:29, memory = 1136.25 (MB).
[INFO DRT-0199]   Number of violations = 0.
[INFO DRT-0267] cpu time = 00:00:56, elapsed time = 00:00:29, memory = 1136.25 (MB), peak = 1816.19 (MB)
Total wire length = 5030 um.
Total wire length on LAYER li1 = 0 um.
Total wire length on LAYER met1 = 1555 um.
Total wire length on LAYER met2 = 1932 um.
Total wire length on LAYER met3 = 150 um.
Total wire length on LAYER met4 = 1391 um.
Total wire length on LAYER met5 = 0 um.
Total number of vias = 82.
Up-via summary (total 82):.

---------------------
 FR_MASTERSLICE     0
            li1    30
           met1    38
           met2    10
           met3     4
           met4     0
---------------------
                   82


[INFO DRT-0198] Complete detail routing.
Total wire length = 5030 um.
Total wire length on LAYER li1 = 0 um.
Total wire length on LAYER met1 = 1555 um.
Total wire length on LAYER met2 = 1932 um.
Total wire length on LAYER met3 = 150 um.
Total wire length on LAYER met4 = 1391 um.
Total wire length on LAYER met5 = 0 um.
Total number of vias = 82.
Up-via summary (total 82):.

---------------------
 FR_MASTERSLICE     0
            li1    30
           met1    38
           met2    10
           met3     4
           met4     0
---------------------
                   82


[INFO DRT-0267] cpu time = 00:01:53, elapsed time = 00:00:58, memory = 1136.25 (MB), peak = 1816.19 (MB)

[INFO DRT-0180] Post processing.
Setting global connections for newly added cells…
Writing OpenROAD database to '/home/engtech/Desktop/Openlane_v2/memristor_v2/openlane/user_proj_example/runs/24_04_23_14_22/results/routing/user_proj_example.odb'…
Writing netlist to '/home/engtech/Desktop/Openlane_v2/memristor_v2/openlane/user_proj_example/runs/24_04_23_14_22/results/routing/user_proj_example.nl.v'…
Writing powered netlist to '/home/engtech/Desktop/Openlane_v2/memristor_v2/openlane/user_proj_example/runs/24_04_23_14_22/results/routing/user_proj_example.pnl.v'…
Writing layout to '/home/engtech/Desktop/Openlane_v2/memristor_v2/openlane/user_proj_example/runs/24_04_23_14_22/results/routing/user_proj_example.def'…
